[
  {
    "id": "L00-M01",
    "title": "Why Markets Exist",
    "time": "15 minutes",
    "visual": "01_market_ecosystem.png",
    "competencies": [
      "financial_literacy",
      "market_mechanics"
    ],
    "prerequisites": [],
    "objective": "Explain the economic purpose of financial markets before learning how to trade them.",
    "why": "A learner who sees a market only as a place to win money will misunderstand nearly every later concept. Markets help transfer ownership, allocate capital, manage risk, and discover prices.",
    "core": [
      "Primary markets connect issuers with capital; secondary markets let existing claims change hands.",
      "Futures and derivatives can transfer price risk between participants with different needs.",
      "The displayed price is the latest result of interacting orders, not a promise about the future."
    ],
    "scenario": "A European manufacturer expects a US-dollar payment in three months and wants less currency uncertainty. Another participant is willing to accept that exposure because of a different forecast or business need. The same market serves both.",
    "exercise": "Write one sentence explaining how an airline, a pension fund, and a short-term trader might each use a financial market.",
    "quiz": [
      [
        "Which is a core market function?",
        "Transferring ownership, capital, and risk."
      ],
      [
        "Do all participants seek the same outcome?",
        "No."
      ],
      [
        "Does an indicator create price?",
        "No."
      ]
    ],
    "mistake": "Treating the market as a machine designed to pay traders.",
    "evidence": "Market fact",
    "sources": [
      "CME_HEDGERS",
      "CME_SPECULATORS",
      "CME_VIDEO"
    ]
  },
  {
    "id": "L00-M02",
    "title": "Investing, Trading, Speculation, and Gambling",
    "time": "18 minutes",
    "visual": "06_mastery_loop.png",
    "competencies": [
      "financial_literacy",
      "ethical_decision_making"
    ],
    "prerequisites": [
      "L00-M01"
    ],
    "objective": "Distinguish activities by decision process rather than by holding period or outcome.",
    "why": "A short holding period does not automatically make an activity gambling. The important differences are evidence, risk limits, repeatability, and whether the decision has a rational basis.",
    "core": [
      "Investing usually seeks participation in longer-term economic value or cash flows.",
      "Trading seeks to manage a shorter-term opportunity with a defined thesis, invalidation, and risk.",
      "Speculation accepts uncertainty in pursuit of gain and can be disciplined or reckless.",
      "Gambling behavior appears when hope, excitement, or uncontrolled size replaces a tested process."
    ],
    "scenario": "Two people buy the same index. One follows a diversified ten-year plan. The other uses extreme leverage after reading a social-media prediction. The instrument is identical; the process is not.",
    "exercise": "Classify three past market decisions as investment, disciplined trade, or gambling behavior. Explain each classification without referring to whether it made money.",
    "quiz": [
      [
        "Can a profitable trade be a poor decision?",
        "Yes."
      ],
      [
        "Is holding time the only distinction?",
        "No."
      ],
      [
        "What matters most?",
        "Process, evidence, and risk."
      ]
    ],
    "mistake": "Judging decision quality only by the profit or loss.",
    "evidence": "Widely accepted professional practice",
    "sources": [
      "CME_RISK"
    ]
  },
  {
    "id": "L00-M03",
    "title": "Who Participates in Markets?",
    "time": "18 minutes",
    "visual": "01_market_ecosystem.png",
    "competencies": [
      "market_mechanics"
    ],
    "prerequisites": [
      "L00-M01"
    ],
    "objective": "Identify major participant groups and understand why their motives differ.",
    "why": "A hedge, an investment, a market-making action, and a speculative trade can produce similar transactions for very different reasons.",
    "core": [
      "Hedgers seek to reduce an existing commercial or portfolio risk.",
      "Speculators intentionally accept price risk in pursuit of profit.",
      "Investors allocate capital according to longer-term objectives.",
      "Market makers quote prices and manage inventory risk.",
      "Brokers provide customer access and route or execute orders.",
      "Exchanges and clearing systems establish rules, matching, and post-trade obligations."
    ],
    "scenario": "A gold producer sells futures to stabilize revenue while a macro fund buys because it expects lower real yields. The matched transaction does not reveal each participant's complete motive.",
    "exercise": "Create a two-column table: participant and likely objective. Include a bank, pension fund, airline, market maker, day trader, and central bank.",
    "quiz": [
      [
        "Who commonly reduces commercial price risk?",
        "A hedger."
      ],
      [
        "Who provides market access to customers?",
        "A broker."
      ],
      [
        "Does a trade print reveal motive with certainty?",
        "No."
      ]
    ],
    "mistake": "Assuming every large transaction is directional speculation.",
    "evidence": "Market fact",
    "sources": [
      "CME_HEDGERS",
      "CME_SPECULATORS"
    ]
  },
  {
    "id": "L00-M04",
    "title": "Exchanges, Brokers, Clearing, and Settlement",
    "time": "20 minutes",
    "visual": "01_market_ecosystem.png",
    "competencies": [
      "market_mechanics"
    ],
    "prerequisites": [
      "L00-M03"
    ],
    "objective": "Trace a transaction from the learner's instruction through execution and settlement.",
    "why": "A platform makes execution look instant, but legal relationships, routing, matching or dealer execution, clearing, and settlement sit behind a click.",
    "core": [
      "A broker receives the client instruction and provides market access.",
      "An exchange or trading venue applies its rules and matches compatible orders.",
      "Clearing manages obligations and counterparty risk according to the market structure.",
      "Settlement completes the transfer of cash and the financial instrument.",
      "CFDs, exchange-traded futures, and shares can have materially different execution and legal structures."
    ],
    "scenario": "A learner presses Buy and sees a confirmation. Behind that message may be routing, execution at a venue or dealer, trade confirmation, clearing, and settlement.",
    "exercise": "Draw the transaction path for one exchange-traded share order and one OTC CFD order. Highlight where their structures differ.",
    "quiz": [
      [
        "Who usually provides the learner's access?",
        "The broker."
      ],
      [
        "Where are compatible exchange orders matched?",
        "At a trading venue or exchange."
      ],
      [
        "Is every product centrally cleared?",
        "No."
      ]
    ],
    "mistake": "Assuming all instruments and brokers use the same execution model.",
    "evidence": "Market fact",
    "sources": [
      "SEC_EXECUTION",
      "FINRA_LIFECYCLE"
    ]
  },
  {
    "id": "L00-M05",
    "title": "Bid, Ask, and the Last Traded Price",
    "time": "18 minutes",
    "visual": "02_order_book.png",
    "competencies": [
      "market_mechanics",
      "chart_reading"
    ],
    "prerequisites": [
      "L00-M04"
    ],
    "objective": "Differentiate the last traded price from current executable quotations.",
    "why": "The last price shown on a chart is not automatically available for a new order.",
    "core": [
      "The bid is the highest displayed price a buyer is currently willing to pay.",
      "The ask is the lowest displayed price a seller is currently willing to accept.",
      "The last price records a completed transaction and may no longer be available.",
      "Quotes can change before an order reaches the market.",
      "Different venues, data feeds, instruments, and brokers can display slightly different prices."
    ],
    "scenario": "The chart shows 100.00, while the best ask is 100.03. An immediate market buy is likely to execute at the ask or worse, not automatically at 100.00.",
    "exercise": "On a demo platform, record bid, ask, spread, and last price five times during an active session.",
    "quiz": [
      [
        "Which quotation is relevant to an immediate buy?",
        "The ask."
      ],
      [
        "Is the last price guaranteed for a new order?",
        "No."
      ],
      [
        "What does the last price represent?",
        "A completed transaction."
      ]
    ],
    "mistake": "Using the last candle close as a guaranteed execution price.",
    "evidence": "Market fact",
    "sources": [
      "SEC_ORDERS",
      "FINRA_ORDERS",
      "TV_ORDER_VIDEO"
    ]
  },
  {
    "id": "L00-M06",
    "title": "The Bid-Ask Spread and Liquidity",
    "time": "20 minutes",
    "visual": "02_order_book.png",
    "competencies": [
      "market_mechanics",
      "risk_management"
    ],
    "prerequisites": [
      "L00-M05"
    ],
    "objective": "Explain the spread as an immediate cost and a partial clue about liquidity.",
    "why": "An aggressive buyer crosses to the ask and an aggressive seller crosses to the bid. This matters especially in frequent trading and thin markets.",
    "core": [
      "Spread equals best ask minus best bid.",
      "Tighter spreads often accompany liquid conditions, but top-of-book size alone does not fully describe liquidity.",
      "Spreads can widen around news, session changes, quiet hours, or stress.",
      "Total transaction cost may include spread, commission, fees, financing, and slippage."
    ],
    "scenario": "Gold has a normal spread before a major release. Seconds before the announcement, quotations widen and available depth changes, increasing execution uncertainty.",